Number,Title,Author,Year,Publisher,Published City,ISBN,DOI
139,Sylvia nisoria. The IUCN Red List of Threatened Species 2016: e.T22716937A87716403.,BirdLife International,2016,International Union for Conservation of Nature,,,10.2305/IUCN.UK.2016-3.RLTS.T22716937A87716403.en
140,"Barred Warbler (Curruca nisoria), version 1.1.","Aymí, R., G. Gargallo, and E. de Juana",2021,"Cornell Lab of Ornithology,","Ithaca, NY, USA",,10.2173/bow.barwar1.01.1
141,Thalasseus bernsteini. The IUCN Red List of Threatened Species 2018: e.T22694585A131118818.,BirdLife International,2018,International Union for Conservation of Nature,,,10.2305/IUCN.UK.2018-2.RLTS.T22694585A131118818.en. 
142,"Chinese Crested Tern (Thalasseus bernsteini), version 1.0.","Gochfeld, M., J. Burger, E. de Juana, C. J. Sharpe, G. M. Kirwan, and E. F. J. Garcia ",2020,"Cornell Lab of Ornithology,","Ithaca, NY, USA",,10.2173/bow.chcter2.01
143,Turdus feae (amended version of 2016 assessment). The IUCN Red List of Threatened Species 2019: e.T22708790A155628935. ,BirdLife International,2019,International Union for Conservation of Nature,,,10.2305/IUCN.UK.2016-3.RLTS.T22708790A155628935.en. 
144,"Gray-sided Thrush (Turdus feae), version 1.0.","Collar, N. ",2020,"Cornell Lab of Ornithology,","Ithaca, NY, USA",,10.2173/bow.gysthr1.01
